{
  "$schema": "./projects.schema.json",
  "lastUpdated": "2026-09-14",
  "featured": [
    {
      "name": "Alembiq",
      "slug": "alembiq",
      "repo": "alawein/alembiq",
      "description": "LLM training, alignment, evaluation, and synthetic data platform.",
      "tags": [
        "Python",
        "PyTorch",
        "LLM Training"
      ],
      "category": "active",
      "legacy_slugs": [
        "neper"
      ],
      "url": "https://alembiq.online",
      "portfolio_domain": "scientific-computing",
      "bucket": "lab",
      "status": "active",
      "visibility": "private"
    },
    {
      "name": "Attributa",
      "slug": "attributa",
      "repo": "alawein/attributa",
      "description": "Privacy-first attribution intelligence with AI detection, citation checks, and CWE scans.",
      "tags": [
        "TypeScript",
        "React",
        "Vite"
      ],
      "category": "active",
      "url": "https://attributa.dev",
      "portfolio_domain": "Work",
      "bucket": "lab",
      "status": "active",
      "visibility": "private"
    },
    {
      "name": "Event Discovery Framework",
      "slug": "edfp",
      "repo": "alawein/edfp",
      "description": "Physics-inspired video event detection with FFT spectral analysis and hierarchical filtering.",
      "tags": [
        "Python",
        "OpenCV",
        "FastAPI"
      ],
      "category": "maintained",
      "legacy_slugs": [
        "event-discovery-framework"
      ],
      "url": "https://edfp.online",
      "portfolio_domain": "Work",
      "bucket": "lab",
      "status": "frozen",
      "visibility": "private"
    },
    {
      "name": "LLMWorks",
      "slug": "llmworks",
      "repo": "alawein/llmworks",
      "description": "LLM evaluation, benchmarking, and security testing playground.",
      "tags": [
        "TypeScript",
        "React",
        "Supabase",
        "LLM"
      ],
      "category": "active",
      "url": "https://llmworks.dev",
      "portfolio_domain": "Work",
      "bucket": "lab",
      "status": "active",
      "visibility": "private"
    },
    {
      "name": "OptiQAP",
      "slug": "optiqap",
      "repo": "alawein/optiqap",
      "description": "Quadratic Assignment Problem solvers with equilibrium-guided optimization and spectral methods.",
      "tags": [
        "Python",
        "Optimization",
        "HPC"
      ],
      "category": "active",
      "legacy_slugs": [
        "qaplibria"
      ],
      "url": "https://optiqap.online",
      "portfolio_domain": "Personal",
      "bucket": "lab",
      "status": "maintained",
      "visibility": "private"
    },
    {
      "name": "Veyra",
      "slug": "veyra",
      "repo": "alawein/veyra",
      "description": "Voice governance for AI-assisted writing: LLM-generated content signals, voice consistency enforcement, web UI, CLI, and shared core logic (Turborepo monorepo).",
      "tags": [
        "TypeScript",
        "Turbo",
        "Governance",
        "Agents"
      ],
      "category": "active",
      "url": "https://github.com/alawein/veyra",
      "bucket": "lab",
      "status": "active",
      "visibility": "private"
    },
    {
      "name": "Atelier Rounaq",
      "slug": "atelier-rounaq",
      "repo": "alawein/atelier-rounaq",
      "description": "Studio and portfolio site for a luxury atelier.",
      "tags": [
        "TypeScript",
        "React",
        "Supabase"
      ],
      "category": "active",
      "legacy_slugs": [
        "rounaq-atelier"
      ],
      "url": "https://atelier-rounaq.com",
      "portfolio_domain": "Work",
      "bucket": "apps",
      "status": "active",
      "visibility": "private"
    },
    {
      "name": "Auditraise",
      "slug": "auditraise",
      "repo": "alawein/auditraise",
      "description": "AI-assisted local marketing audits with operator dashboard and follow-up content workflows.",
      "tags": [
        "TypeScript",
        "Next.js",
        "Marketing"
      ],
      "category": "active",
      "url": "https://github.com/alawein/auditraise",
      "portfolio_domain": "Work",
      "bucket": "apps",
      "status": "active",
      "visibility": "private"
    },
    {
      "name": "Bolts",
      "slug": "bolts",
      "repo": "alawein/bolts",
      "description": "Fitness transformation plans with Next.js, Stripe, Supabase, and Python tooling.",
      "tags": [
        "Next.js",
        "TypeScript"
      ],
      "category": "active",
      "url": "https://bolts.fit",
      "portfolio_domain": "Work",
      "bucket": "apps",
      "status": "active",
      "visibility": "private"
    },
    {
      "name": "Gymboy",
      "slug": "gymboy",
      "repo": "alawein/gymboy",
      "description": "Fitness coaching platform with a retro progression-first training interface.",
      "tags": [
        "React",
        "Vite",
        "Spark"
      ],
      "category": "active",
      "legacy_slugs": [
        "gainboy"
      ],
      "url": "https://gymboy.coach",
      "portfolio_domain": "Personal",
      "bucket": "apps",
      "status": "active",
      "visibility": "private"
    },
    {
      "name": "REPZ",
      "slug": "repz",
      "repo": "alawein/repz",
      "description": "AI-powered coaching platform for fitness professionals and clients.",
      "tags": [
        "TypeScript",
        "React",
        "Supabase"
      ],
      "category": "active",
      "url": "https://repzcoach.com",
      "portfolio_domain": "Personal",
      "bucket": "apps",
      "status": "active",
      "visibility": "private"
    },
    {
      "name": "Scribd",
      "slug": "scribd",
      "repo": "alawein/scribd",
      "description": "Fitness publishing and content surface.",
      "tags": [
        "Next.js",
        "React",
        "TypeScript"
      ],
      "category": "active",
      "url": "https://scribd.fit",
      "portfolio_domain": "Work",
      "bucket": "apps",
      "status": "active",
      "visibility": "private"
    },
    {
      "name": "meshal.ai",
      "slug": "meshal-web",
      "repo": "alawein/meshal-web",
      "description": "Personal site and portfolio with project deep-dives, case studies, and contact.",
      "tags": [
        "React",
        "Vite",
        "TypeScript",
        "Tailwind"
      ],
      "category": "maintained",
      "url": "https://www.meshal.ai",
      "portfolio_domain": "Personal",
      "bucket": "sites",
      "status": "maintained",
      "visibility": "private",
      "vercel": {
        "team_slug": "alawein",
        "project_slug": "meshal-web",
        "production_url": null,
        "custom_domain": null,
        "state": "preview-only",
        "last_synced_at": "2026-09-07T17:15:00Z"
      }
    }
  ],
  "notion_sync": [
    {
      "name": "Adil",
      "slug": "adil",
      "repo": "alawein/adil",
      "description": "Legal-ops CLI for assembling, validating, and submitting evidence packets.",
      "tags": [
        "Python",
        "Legal AI",
        "CLI"
      ],
      "category": "active",
      "url": "https://github.com/alawein/adil",
      "portfolio_domain": "Personal",
      "bucket": "lab",
      "status": "active",
      "visibility": "private"
    },
    {
      "name": "meatheadphysicist",
      "slug": "meatheadphysicist",
      "repo": "alawein/meatheadphysicist",
      "description": "Computational physics research platform for Bell inequality analysis, CHSH simulation, and claim verification.",
      "tags": [
        "Python",
        "Physics",
        "FastAPI",
        "Research"
      ],
      "category": "active",
      "legacy_slugs": [
        "MeatheadPhysicist"
      ],
      "url": "https://mhphys.online",
      "portfolio_domain": "Personal",
      "bucket": "lab",
      "status": "active",
      "visibility": "private"
    },
    {
      "name": "qmlab.online",
      "slug": "qmlab",
      "repo": "alawein/qmlab",
      "description": "Quantum ML web lab with React, TypeScript, Vite, and Supabase.",
      "tags": [
        "TypeScript",
        "React",
        "Vite",
        "Supabase"
      ],
      "category": "maintained",
      "url": "https://qmlab.online",
      "portfolio_domain": "Personal",
      "bucket": "lab",
      "status": "frozen",
      "visibility": "private"
    },
    {
      "name": "simcore.dev",
      "slug": "simcore",
      "repo": "alawein/simcore",
      "description": "Scientific simulation core for interactive modeling and numerical exploration.",
      "tags": [
        "TypeScript",
        "React",
        "Vite",
        "Plotly"
      ],
      "category": "active",
      "url": "https://simcore.dev",
      "portfolio_domain": "Work",
      "bucket": "lab",
      "status": "active",
      "visibility": "private"
    },
    {
      "name": "Roka: Oakland Hustle",
      "slug": "roka-oakland-hustle",
      "repo": "alawein/roka-oakland-hustle",
      "description": "Retro narrative RPG set in Oakland with a 7-day arc and 32 quests.",
      "tags": [
        "Godot",
        "GDScript",
        "RPG",
        "Game"
      ],
      "category": "maintained",
      "url": "https://github.com/alawein/roka-oakland-hustle",
      "portfolio_domain": "Personal",
      "bucket": "sites",
      "status": "active",
      "visibility": "private"
    }
  ],
  "research": [
    {
      "name": "Helios",
      "slug": "helios",
      "repo": "alawein/helios",
      "domain": "Proprietary research archive \u2014 computational astrophysics",
      "description": "Proprietary research archive for computational astrophysics and astronomy work.",
      "url": "https://github.com/alawein/helios",
      "category": "archived",
      "bucket": "archive",
      "status": "archived",
      "visibility": "private"
    },
    {
      "name": "Adil",
      "slug": "adil",
      "repo": "alawein/adil",
      "domain": "Legal-ops automation: matter records, evidence processing, agency or court submission packets (solo or small-firm workflow).",